{
  "name": "engagement",
  "package": "@kyletaylored/datadog-rum-plugin-engagement",
  "exportName": "engagementPlugin",
  "version": "0.2.0",
  "family": "engagement",
  "title": "Engagement",
  "description": "The events analytics tools capture automatically — scroll depth, outbound and contact clicks, file downloads, video plays and form submissions — with no instrumentation. Works on any site.",
  "maintainer": {
    "name": "Kyle Taylor",
    "github": "kyletaylored"
  },
  "tier": "seed",
  "schemaVersion": "1.1.0",
  "rumSdk": ">=7.0.0 <8.0.0",
  "platforms": [
    {
      "name": "Any website",
      "notes": "No platform integration required. Reads only the DOM, so it works alongside a commerce or consent plugin."
    }
  ],
  "install": {
    "npm": true,
    "cdn": true,
    "platform": "Google Tag Manager Custom HTML tag"
  },
  "actions": [
    "engagement.scroll",
    "engagement.click",
    "engagement.file_download",
    "engagement.video_start",
    "engagement.video_progress",
    "engagement.video_complete",
    "engagement.form_start",
    "engagement.form_submit",
    "lead.generate_lead"
  ],
  "journey": [
    {
      "label": "Reads half the page",
      "fixture": "reads half the page"
    },
    {
      "label": "Reads to the bottom",
      "fixture": "reads to the bottom"
    },
    {
      "label": "Clicks an outbound link",
      "fixture": "clicks an outbound link"
    },
    {
      "label": "Clicks a link carrying an access token",
      "fixture": "clicks a link carrying an access token"
    },
    {
      "label": "Clicks an email address",
      "fixture": "clicks an email address"
    },
    {
      "label": "Clicks a phone number",
      "fixture": "clicks a phone number"
    },
    {
      "label": "Clicks an internal link",
      "fixture": "clicks an internal link"
    },
    {
      "label": "Downloads a report",
      "fixture": "downloads a report"
    },
    {
      "label": "Starts a video",
      "fixture": "starts a video"
    },
    {
      "label": "Watches half the video",
      "fixture": "watches half the video"
    },
    {
      "label": "Finishes the video",
      "fixture": "finishes the video"
    },
    {
      "label": "Starts filling the newsletter form",
      "fixture": "starts filling the newsletter form"
    },
    {
      "label": "Submits the newsletter form",
      "fixture": "submits the newsletter form"
    },
    {
      "label": "Submits the site search",
      "fixture": "submits an ordinary form"
    }
  ],
  "howItWorks": {
    "summary": "Reads the page itself. A few delegated listeners on the document see what a visitor does, so nothing on the site needs instrumenting and it works on any site.",
    "steps": [
      {
        "title": "Scroll depth",
        "detail": "A passive `scroll` listener measures depth at most once per animation frame and fires `engagement.scroll` at 25, 50, 75 and 90% (`scrollThresholds`), each once per view. `popstate` on `window` resets the thresholds on back and forward navigation."
      },
      {
        "title": "Links, contact links and downloads",
        "detail": "One capture-phase `click` listener on `document` reads the clicked link: outbound links, `mailto:` and `tel:` links (their kind only, never the address), and downloads by file extension. Internal links are skipped, because RUM already records them as views. A URL's query string and fragment are never sent."
      },
      {
        "title": "HTML5 video",
        "detail": "`play`, `timeupdate` and `ended` do not bubble, so they are captured on `document` for every `<video>`: start, progress at 10, 25, 50 and 75%, and completion."
      },
      {
        "title": "Forms, without reading a field",
        "detail": "`focusin` marks a form as started, once. `submit` reports the form's id, label and destination host. No field value is read, at any point. A form marked `data-dd-lead` (or `data-lead`) also sends `lead.generate_lead`."
      },
      {
        "title": "Consent",
        "detail": "It has no consent source of its own. Pair it with a consent plugin, or pass `consent: 'ignore'` when the page already holds RUM's tracking consent."
      }
    ]
  },
  "options": [
    {
      "name": "scrollThresholds",
      "type": "array",
      "default": [
        25,
        50,
        75,
        90
      ],
      "description": "Depth percentages that fire engagement.scroll. Each fires once per view."
    },
    {
      "name": "videoThresholds",
      "type": "array",
      "default": [
        10,
        25,
        50,
        75
      ],
      "description": "Progress percentages that fire engagement.video_progress."
    },
    {
      "name": "downloadExtensions",
      "type": "array",
      "default": null,
      "description": "Extensions treated as a download. Defaults to common documents, archives and media."
    },
    {
      "name": "leadFormSelector",
      "type": "string",
      "default": "[data-dd-lead], form[data-lead]",
      "description": "Forms matching this also emit lead.generate_lead on submit."
    },
    {
      "name": "trackScroll",
      "type": "boolean",
      "default": true,
      "description": "Scroll depth thresholds."
    },
    {
      "name": "trackClicks",
      "type": "boolean",
      "default": true,
      "description": "Outbound, mailto and tel clicks."
    },
    {
      "name": "trackDownloads",
      "type": "boolean",
      "default": true,
      "description": "File download clicks."
    },
    {
      "name": "trackVideo",
      "type": "boolean",
      "default": true,
      "description": "HTML5 video start, progress and completion."
    },
    {
      "name": "trackForms",
      "type": "boolean",
      "default": true,
      "description": "Form start and submit."
    },
    {
      "name": "actionPrefix",
      "type": "string",
      "default": "commerce.",
      "description": "Renames the commerce prefix only; engagement and lead keep their own."
    },
    {
      "name": "consent",
      "type": "string",
      "default": "auto",
      "description": "auto holds events until consent is granted, ignore defers to the host page."
    },
    {
      "name": "beforeTrack",
      "type": "function",
      "default": null,
      "description": "Edit or drop an event before it is sent."
    },
    {
      "name": "debug",
      "type": "boolean",
      "default": false,
      "description": "Log every mapped event to the console."
    }
  ],
  "footprint": {
    "globals": [
      "document",
      "window"
    ],
    "events": [
      "scroll",
      "click",
      "play",
      "timeupdate",
      "ended",
      "focusin",
      "submit",
      "popstate"
    ],
    "storageKeys": [],
    "rumApis": [
      "addAction",
      "setGlobalContextProperty"
    ],
    "consentSource": null
  },
  "docs": "https://kyletaylored.github.io/datadog-rum-community-plugins/plugins/engagement/"
}
