{
  "name": "onetrust",
  "package": "@kyletaylored/datadog-rum-plugin-onetrust",
  "exportName": "oneTrustPlugin",
  "version": "0.2.0",
  "family": "consent",
  "title": "OneTrust",
  "description": "Holds Datadog RUM until the visitor accepts OneTrust's analytics category, then reports the accepted categories as session context.",
  "maintainer": {
    "name": "Kyle Taylor",
    "github": "kyletaylored"
  },
  "tier": "seed",
  "schemaVersion": "1.1.0",
  "rumSdk": ">=7.0.0 <8.0.0",
  "platforms": [
    {
      "name": "OneTrust Cookie Consent",
      "notes": "Any site running the OneTrust banner script (otSDKStub.js)."
    }
  ],
  "install": {
    "npm": true,
    "cdn": true,
    "platform": "Google Tag Manager Custom HTML tag"
  },
  "actions": [],
  "journey": [
    {
      "label": "Banner appears, not answered",
      "fixture": "banner not yet answered"
    },
    {
      "label": "Rejects everything optional",
      "fixture": "strictly necessary only"
    },
    {
      "label": "Accepts analytics cookies",
      "fixture": "performance accepted"
    },
    {
      "label": "Accepts all cookies",
      "fixture": "all categories accepted"
    },
    {
      "label": "Later turns analytics off",
      "fixture": "consent withdrawn"
    }
  ],
  "howItWorks": {
    "summary": "Holds RUM before it starts, then releases it when OneTrust reports that the visitor accepted the required category. It sends no actions of its own.",
    "steps": [
      {
        "title": "Holds RUM before the SDK starts",
        "detail": "In `onInit` it sets `trackingConsent` to not-granted in the init options, so the SDK collects nothing on a page where the banner hasn't been answered. Put it first in `plugins`."
      },
      {
        "title": "Reads the visitor's answer",
        "detail": "`window.OnetrustActiveGroups` is the comma-delimited list of accepted categories that OneTrust's banner script sets, e.g. `,C0001,C0002,`. The plugin reads it at init, in case the visitor answered on an earlier page."
      },
      {
        "title": "Listens on every signal OneTrust sends",
        "detail": "It listens for `OneTrustGroupsUpdated` on the window, wraps `window.OptanonWrapper` (chaining the page's own wrapper, if any), and once the banner script has loaded registers `Optanon.OnConsentChanged` on `window.Optanon`. Each one re-reads the active groups, so any one of them firing is enough."
      },
      {
        "title": "Grants, or withdraws",
        "detail": "When the required category (C0002 by default) is active it calls `setTrackingConsent('granted')`, and `'not-granted'` if the visitor later turns it off. The accepted categories go to session context as `consent.categories` through `setGlobalContextProperty`."
      },
      {
        "title": "Fails closed",
        "detail": "If OneTrust never reports within the timeout, RUM stays held and a warning is logged. A `pagehide` listener clears the timer."
      }
    ]
  },
  "options": [
    {
      "name": "category",
      "type": "string",
      "default": "C0002",
      "description": "OneTrust category that must be active before RUM may collect. Accepts an array for sites that require several."
    },
    {
      "name": "reportCategories",
      "type": "boolean",
      "default": true,
      "description": "Send the accepted categories as the consent.categories global context property."
    },
    {
      "name": "timeoutMs",
      "type": "number",
      "default": 10000,
      "description": "How long to wait for the banner script before warning. RUM stays held either way."
    },
    {
      "name": "debug",
      "type": "boolean",
      "default": false,
      "description": "Log consent transitions to the console."
    }
  ],
  "footprint": {
    "globals": [
      "window.OnetrustActiveGroups",
      "window.Optanon",
      "window.OptanonWrapper"
    ],
    "events": [
      "OneTrustGroupsUpdated",
      "Optanon.OnConsentChanged",
      "OptanonWrapper",
      "pagehide"
    ],
    "storageKeys": [],
    "rumApis": [
      "setTrackingConsent",
      "setGlobalContextProperty"
    ],
    "consentSource": "OneTrust OnetrustActiveGroups"
  },
  "docs": "https://kyletaylored.github.io/datadog-rum-community-plugins/plugins/onetrust/"
}
