{
  "name": "woocommerce",
  "package": "@kyletaylored/datadog-rum-plugin-woocommerce",
  "exportName": "wooCommercePlugin",
  "version": "0.2.0",
  "family": "commerce",
  "title": "WooCommerce",
  "description": "Cart, checkout and order events from WooCommerce's own storefront DOM events, plus order data printed on the order-received page.",
  "maintainer": {
    "name": "Kyle Taylor",
    "github": "kyletaylored"
  },
  "tier": "seed",
  "schemaVersion": "1.2.0",
  "rumSdk": ">=7.0.0 <8.0.0",
  "platforms": [
    {
      "name": "WooCommerce",
      "versions": ">=8.0",
      "notes": "Cart and Checkout blocks. Classic themes are covered through the jQuery added_to_cart event."
    },
    {
      "name": "WordPress",
      "versions": ">=6.4"
    }
  ],
  "install": {
    "npm": true,
    "cdn": true,
    "platform": "WordPress plugin"
  },
  "actions": [
    "commerce.view_item_list",
    "commerce.add_to_cart",
    "commerce.remove_from_cart",
    "commerce.view_cart",
    "commerce.begin_checkout",
    "commerce.add_shipping_info",
    "commerce.add_payment_info",
    "commerce.purchase",
    "commerce.search"
  ],
  "journey": [
    {
      "label": "Searches for \"red tee medium\"",
      "fixture": "product search"
    },
    {
      "label": "Adds 2 t-shirts to the cart",
      "fixture": "added to cart"
    },
    {
      "label": "Removes the cap",
      "fixture": "removed from cart"
    },
    {
      "label": "Adds socks on a classic theme",
      "fixture": "added to cart on a classic theme"
    },
    {
      "label": "Opens the cart",
      "fixture": "cart viewed"
    },
    {
      "label": "Starts checkout",
      "fixture": "checkout started"
    },
    {
      "label": "Chooses Ground shipping",
      "fixture": "shipping chosen"
    },
    {
      "label": "Pays with PayPal",
      "fixture": "payment chosen"
    },
    {
      "label": "Lands on the thank-you page",
      "fixture": "order received"
    },
    {
      "label": "Reloads the thank-you page",
      "fixture": "order received"
    }
  ],
  "howItWorks": {
    "summary": "Listens for the DOM events WooCommerce's Cart and Checkout blocks already dispatch, and reads the order the companion WordPress plugin prints on the order-received page. Nothing is added to your theme.",
    "steps": [
      {
        "title": "Reads the store, the customer and the order",
        "detail": "At init it reads `window.ddRumWooCommerce`, which the companion WordPress plugin prints: store and customer on every page, plus the order on the order-received page. The store becomes session context, the WordPress user ID goes to `setUser`, and the order becomes `commerce.purchase`."
      },
      {
        "title": "Listens on document.body",
        "detail": "It adds one native listener per WooCommerce event on `document.body`: `wc-blocks_added_to_cart`, `wc-blocks_removed_from_cart` and `wc-blocks_product_list_rendered` from the blocks, plus `added_to_cart` and `removed_from_cart` for classic themes. Each event carries the Store API cart in `detail.cart`, which the plugin maps to the commerce schema."
      },
      {
        "title": "Classic themes and jQuery",
        "detail": "`window.jQuery` is in the footprint because classic themes raise `added_to_cart` through it. The plugin listens with native `addEventListener` only, so it sees the event when a theme dispatches it as a DOM event, and not when a theme fires it only through jQuery."
      },
      {
        "title": "Reports the checkout funnel on request",
        "detail": "Cart views, checkout, shipping, payment and search have no WooCommerce DOM event. The WordPress plugin, or a theme, reports them by calling `createCheckoutReporter` from the blocks' hooks (`window.DD_RUM_PLUGINS.woocommerce.createCheckoutReporter` on the CDN)."
      },
      {
        "title": "Counts each order once",
        "detail": "The core records each sent `transaction_id` in `dd_rum_commerce_seen` in localStorage for 24 hours, so a reloaded order-received page does not send the purchase again."
      }
    ]
  },
  "options": [
    {
      "name": "events",
      "type": "array",
      "default": null,
      "description": "Allow-list of commerce actions. Every action in the schema by default."
    },
    {
      "name": "identifyUsers",
      "type": "boolean",
      "default": true,
      "description": "Call setUser with the WordPress user ID."
    },
    {
      "name": "includeEmail",
      "type": "boolean",
      "default": false,
      "description": "Add the customer email to setUser."
    },
    {
      "name": "includeName",
      "type": "boolean",
      "default": false,
      "description": "Add the customer name to setUser."
    },
    {
      "name": "includeItems",
      "type": "boolean",
      "default": false,
      "description": "Attach items[], capped at 20 entries."
    },
    {
      "name": "actionPrefix",
      "type": "string",
      "default": "commerce.",
      "description": "Rename the action prefix if the site has its own convention."
    },
    {
      "name": "consent",
      "type": "string",
      "default": "auto",
      "description": "auto reads the consent signal, ignore skips the gate, or supply a resolver callback."
    },
    {
      "name": "beforeTrack",
      "type": "function",
      "default": null,
      "description": "Edit or drop an event before it is sent."
    },
    {
      "name": "dataGlobal",
      "type": "string",
      "default": "ddRumWooCommerce",
      "description": "Global holding the server-rendered store, customer and order payload."
    },
    {
      "name": "debug",
      "type": "boolean",
      "default": false,
      "description": "Log every mapped event to the console."
    }
  ],
  "footprint": {
    "globals": [
      "window.ddRumWooCommerce",
      "window.jQuery",
      "document.body"
    ],
    "events": [
      "wc-blocks_added_to_cart",
      "wc-blocks_removed_from_cart",
      "wc-blocks_product_list_rendered",
      "added_to_cart",
      "removed_from_cart"
    ],
    "storageKeys": [
      "dd_rum_commerce_seen"
    ],
    "rumApis": [
      "addAction",
      "setGlobalContextProperty",
      "setUser",
      "clearUser"
    ],
    "consentSource": "WP Consent API (via the consent option or a consent plugin)"
  },
  "docs": "https://kyletaylored.github.io/datadog-rum-community-plugins/plugins/woocommerce/"
}
